{
  "$schema": "https://json-schema.org/draft/2020-12/schema",
  "$id": "https://carpinova.local/schemas/figure.schema.json",
  "type": "object",
  "required": ["figure_id", "page_id", "type", "purpose", "source", "entities", "relationships", "measurements", "annotations", "reconstruction"],
  "additionalProperties": false,
  "$defs": {
    "normalizedPoint": {
      "type": "object",
      "required": ["x", "y"],
      "additionalProperties": false,
      "properties": {
        "x": {"type": "number", "minimum": 0, "maximum": 1},
        "y": {"type": "number", "minimum": 0, "maximum": 1}
      }
    },
    "normalizedBounds": {
      "type": "object",
      "required": ["x", "y", "width", "height"],
      "additionalProperties": false,
      "properties": {
        "x": {"type": "number", "minimum": 0, "maximum": 1},
        "y": {"type": "number", "minimum": 0, "maximum": 1},
        "width": {"type": "number", "exclusiveMinimum": 0, "maximum": 1},
        "height": {"type": "number", "exclusiveMinimum": 0, "maximum": 1}
      }
    },
    "fullViewport": {
      "type": "object",
      "required": ["x", "y", "width", "height"],
      "additionalProperties": false,
      "properties": {
        "x": {"const": 0},
        "y": {"const": 0},
        "width": {"const": 1},
        "height": {"const": 1}
      }
    },
    "placement": {
      "type": "object",
      "required": ["x", "y", "precision"],
      "additionalProperties": false,
      "properties": {
        "x": {"type": "number", "minimum": 0, "maximum": 1},
        "y": {"type": "number", "minimum": 0, "maximum": 1},
        "precision": {"enum": ["exact", "approximate", "unknown"]}
      }
    }
  },
  "properties": {
    "figure_id": {"$ref": "https://carpinova.local/schemas/common.schema.json#/$defs/figureId"},
    "page_id": {"$ref": "https://carpinova.local/schemas/common.schema.json#/$defs/pageId"},
    "type": {"enum": ["technical_diagram", "dimensioned_drawing", "exploded_view", "process_diagram", "assembly_sequence", "illustration", "photo", "table", "form", "3d_reference", "mixed"]},
    "purpose": {"type": "string", "minLength": 1},
    "source": {"$ref": "https://carpinova.local/schemas/common.schema.json#/$defs/source"},
    "entities": {
      "type": "array",
      "items": {
        "type": "object",
        "required": ["id", "type", "geometry"],
        "additionalProperties": true,
        "properties": {
          "id": {"type": "string", "minLength": 1},
          "type": {"type": "string", "minLength": 1},
          "geometry": {
            "type": "object",
            "required": ["precision"],
            "additionalProperties": true,
            "properties": {
              "primitive": {"type": ["string", "null"]},
              "precision": {"enum": ["exact", "approximate", "unknown"]},
              "dimensions": {"type": "object", "minProperties": 1}
            },
            "allOf": [
              {
                "if": {"properties": {"precision": {"const": "unknown"}}, "required": ["precision"]},
                "then": {"not": {"required": ["dimensions"]}}
              }
            ]
          }
        }
      }
    },
    "relationships": {"type": "array", "items": {"type": "object"}},
    "measurements": {"type": "array", "items": {"$ref": "https://carpinova.local/schemas/common.schema.json#/$defs/measurementId"}},
    "annotations": {"type": "array", "items": {"type": "object"}},
    "layers": {"type": "array", "items": {"type": "object"}},
    "camera": {"type": "object"},
    "visual_style": {"type": "object"},
    "educational_sequence": {"type": "array", "items": {"type": "object"}},
    "reconstruction": {
      "type": "object",
      "required": ["preferred_renderer", "deterministic_required", "generative_image_allowed"],
      "additionalProperties": false,
      "properties": {
        "preferred_renderer": {"enum": ["svg", "html", "3d", "image", "hybrid"]},
        "deterministic_required": {"type": "boolean"},
        "generative_image_allowed": {"type": "boolean"},
        "render_contract": {"enum": ["normalized-2d-v1", "semantic-table-v1"]}
      }
    },
    "accessibility": {"type": "object"},
    "review": {"type": "object"}
  },
  "allOf": [
    {
      "if": {
        "properties": {
          "reconstruction": {
            "properties": {"render_contract": {"const": "normalized-2d-v1"}},
            "required": ["render_contract"]
          }
        },
        "required": ["reconstruction"]
      },
      "then": {
        "required": ["camera", "layers"],
        "properties": {
          "camera": {
            "type": "object",
            "required": ["coordinate_space", "viewport"],
            "additionalProperties": false,
            "properties": {
              "coordinate_space": {"const": "normalized_figure"},
              "viewport": {"$ref": "#/$defs/fullViewport"}
            }
          },
          "entities": {
            "type": "array",
            "items": {
              "type": "object",
              "properties": {
                "geometry": {
                  "oneOf": [
                    {
                      "required": ["primitive", "bounds"],
                      "properties": {
                        "primitive": {"const": "rect"},
                        "bounds": {"$ref": "#/$defs/normalizedBounds"}
                      }
                    },
                    {
                      "required": ["primitive", "points"],
                      "properties": {
                        "primitive": {"const": "line"},
                        "points": {
                          "type": "array",
                          "minItems": 2,
                          "maxItems": 2,
                          "items": {"$ref": "#/$defs/normalizedPoint"}
                        }
                      }
                    },
                    {
                      "required": ["primitive", "points"],
                      "properties": {
                        "primitive": {"const": "polyline"},
                        "points": {
                          "type": "array",
                          "minItems": 2,
                          "items": {"$ref": "#/$defs/normalizedPoint"}
                        }
                      }
                    }
                  ]
                }
              }
            }
          },
          "annotations": {
            "type": "array",
            "items": {
              "type": "object",
              "properties": {
                "placement": {"$ref": "#/$defs/placement"}
              }
            }
          },
          "layers": {
            "type": "array",
            "minItems": 1,
            "items": {
              "type": "object",
              "required": ["id", "order"],
              "additionalProperties": false,
              "properties": {
                "id": {"type": "string", "minLength": 1},
                "order": {"type": "integer"},
                "entity_ids": {
                  "type": "array",
                  "minItems": 1,
                  "uniqueItems": true,
                  "items": {"type": "string", "minLength": 1}
                },
                "annotation_ids": {
                  "type": "array",
                  "minItems": 1,
                  "uniqueItems": true,
                  "items": {"type": "string", "minLength": 1}
                }
              },
              "anyOf": [
                {"required": ["entity_ids"]},
                {"required": ["annotation_ids"]}
              ]
            }
          }
        }
      }
    },
    {
      "if": {
        "properties": {
          "reconstruction": {
            "properties": {"render_contract": {"const": "semantic-table-v1"}},
            "required": ["render_contract"]
          }
        },
        "required": ["reconstruction"]
      },
      "then": {
        "properties": {
          "type": {"const": "table"},
          "reconstruction": {
            "properties": {
              "preferred_renderer": {"const": "html"},
              "deterministic_required": {"const": true},
              "generative_image_allowed": {"const": false}
            }
          },
          "entities": {
            "items": {
              "allOf": [
                {
                  "if": {
                    "properties": {"type": {"const": "checklist_section"}},
                    "required": ["type"]
                  },
                  "then": {
                    "required": ["headers", "rows"],
                    "properties": {
                      "headers": {
                        "type": "array",
                        "minItems": 1,
                        "items": {"type": "string", "minLength": 1}
                      },
                      "rows": {
                        "type": "array",
                        "items": {
                          "type": "array",
                          "items": {"type": "string"}
                        }
                      }
                    }
                  }
                }
              ]
            }
          }
        }
      }
    }
  ]
}
