{"figure_id":"FIG-CPNC-2025-P0136-001","page_id":"PAGE-CPNC-2025-P0136","type":"table","purpose":"Recrear la comparativa de seis sistemas Venetto para divisiones de ambiente, preservando por tarjeta cantidad de hojas, espesor, ubicación, capacidad, rieles/modelo y rangos de ancho cuando aparecen en la fuente.","source":{"book_id":"cpnc-2025","pdf_page":136,"printed_page":114,"region":{"x":0.04,"y":0.08,"width":0.92,"height":0.82},"extraction":{"method":"visual","confidence":0.98,"review_status":"VISUALLY_VERIFIED"}},"entities":[{"id":"sd80-no-brake","type":"product_card","description":"Tarjeta SD 80 Sin Freno.","geometry":{"precision":"approximate","bbox":{"x":0.04,"y":0.1,"width":0.43,"height":0.23}}},{"id":"sd80-with-brake","type":"product_card","description":"Tarjeta SD 80 Con Freno.","geometry":{"precision":"approximate","bbox":{"x":0.52,"y":0.1,"width":0.43,"height":0.23}}},{"id":"sd80-4h","type":"product_card","description":"Tarjeta SD 80 - 4H Plegable.","geometry":{"precision":"approximate","bbox":{"x":0.04,"y":0.37,"width":0.43,"height":0.22}}},{"id":"magic-door","type":"product_card","description":"Tarjeta Magic Door (Puerta Invisible).","geometry":{"precision":"approximate","bbox":{"x":0.52,"y":0.37,"width":0.43,"height":0.22}}},{"id":"gemmelo-telescopico","type":"product_card","description":"Tarjeta Gemmelo Telescópico GD186.","geometry":{"precision":"approximate","bbox":{"x":0.04,"y":0.64,"width":0.43,"height":0.22}}},{"id":"gemmelo-opuesto","type":"product_card","description":"Tarjeta Gemmelo Opuesto GD186.","geometry":{"precision":"approximate","bbox":{"x":0.52,"y":0.64,"width":0.43,"height":0.22}}}],"relationships":[{"from":"sd80-no-brake","to":"sd80-with-brake","type":"compared_with"},{"from":"sd80-with-brake","to":"sd80-4h","type":"compared_with"},{"from":"sd80-4h","to":"magic-door","type":"compared_with"},{"from":"magic-door","to":"gemmelo-telescopico","type":"compared_with"},{"from":"gemmelo-telescopico","to":"gemmelo-opuesto","type":"compared_with"}],"measurements":["MEAS-CPNC-2025-P0136-001","MEAS-CPNC-2025-P0136-002","MEAS-CPNC-2025-P0136-003","MEAS-CPNC-2025-P0136-004","MEAS-CPNC-2025-P0136-005","MEAS-CPNC-2025-P0136-006","MEAS-CPNC-2025-P0136-007","MEAS-CPNC-2025-P0136-008","MEAS-CPNC-2025-P0136-009","MEAS-CPNC-2025-P0136-010","MEAS-CPNC-2025-P0136-011","MEAS-CPNC-2025-P0136-012","MEAS-CPNC-2025-P0136-013","MEAS-CPNC-2025-P0136-014","MEAS-CPNC-2025-P0136-015","MEAS-CPNC-2025-P0136-016","MEAS-CPNC-2025-P0136-017","MEAS-CPNC-2025-P0136-018","MEAS-CPNC-2025-P0136-019","MEAS-CPNC-2025-P0136-020","MEAS-CPNC-2025-P0136-021","MEAS-CPNC-2025-P0136-022","MEAS-CPNC-2025-P0136-023","MEAS-CPNC-2025-P0136-024"],"annotations":[{"target_entity_id":"sd80-no-brake","text":"SD 80 SIN FRENO — 1P — 30 mm — 80 kg — U21/U100"},{"target_entity_id":"sd80-with-brake","text":"SD 80 CON FRENO — 1P — 30 mm — 80 kg — U21/U100"},{"target_entity_id":"sd80-4h","text":"SD 80-4H PLEGABLE — 4P — 20 mm — DV — 40 kg"},{"target_entity_id":"magic-door","text":"MAGIC DOOR — 1P — >35 mm — FV — 80 kg — AP 800–1220 mm"},{"target_entity_id":"gemmelo-telescopico","text":"GEMMELO TELESCÓPICO GD186 — 4P — 30 mm — DV — 80 kg — AP 820–1200 mm"},{"target_entity_id":"gemmelo-opuesto","text":"GEMMELO OPUESTO GD186 — 4P — 30 mm — DV — 60 kg — AP 820–1200 mm"}],"layers":[{"id":"header-layer","description":"Cabecera roja de sistemas para divisiones de ambiente."},{"id":"cards-layer","description":"Cuadrícula 2x3 de sistemas."},{"id":"spec-layer","description":"Iconos y especificaciones bajo cada tarjeta."}],"camera":{"view":"front","projection":"graphic_catalog"},"visual_style":{"background":"dark gray","headers":"red/white","cards":"dark gray with red bars","product_photos":"hardware and door applications"},"educational_sequence":[{"step":1,"show_entity_ids":["sd80-no-brake","sd80-with-brake","sd80-4h"],"instruction":"Comparar las variantes SD80."},{"step":2,"show_entity_ids":["magic-door","gemmelo-telescopico","gemmelo-opuesto"],"instruction":"Comparar las soluciones de puerta invisible y múltiples hojas."}],"reconstruction":{"preferred_renderer":"html","deterministic_required":true,"generative_image_allowed":false},"accessibility":{"summary":"Cuadrícula de seis sistemas Venetto para divisiones de ambiente con variantes SD80, Magic Door y Gemmelo."},"review":{"status":"VISUALLY_VERIFIED","notes":"Todos los valores pertenecen a esta ficha de fabricante y deben mantenerse ligados al modelo correspondiente."}}
