{
  "figure_id": "FIG-CPNC-2025-P0203-001",
  "page_id": "PAGE-CPNC-2025-P0203",
  "type": "dimensioned_drawing",
  "purpose": "Recrear la referencia visual de distribución vertical de entrepaños y tubos colgaderos de un clóset.",
  "source": {
    "book_id": "cpnc-2025",
    "pdf_page": 203,
    "printed_page": 181,
    "region": {"x": 0.0, "y": 0.0, "width": 1.0, "height": 1.0},
    "extraction": {
      "method": "visual",
      "confidence": 0.99,
      "review_status": "VISUALLY_VERIFIED"
    }
  },
  "entities": [
    {
      "id": "closet",
      "type": "closet",
      "geometry": {
        "precision": "approximate",
        "primitive": "rect",
        "bounds": {"x": 0.15, "y": 0.10, "width": 0.70, "height": 0.78}
      }
    },
    {
      "id": "overhead-shelf",
      "type": "maletero_shelf",
      "geometry": {
        "precision": "approximate",
        "primitive": "rect",
        "bounds": {"x": 0.19, "y": 0.22, "width": 0.62, "height": 0.07}
      }
    },
    {
      "id": "upper-rod",
      "type": "hanger_rod",
      "geometry": {
        "precision": "approximate",
        "primitive": "line",
        "points": [
          {"x": 0.24, "y": 0.39},
          {"x": 0.58, "y": 0.39}
        ]
      }
    },
    {
      "id": "lower-rod",
      "type": "hanger_rod",
      "geometry": {
        "precision": "approximate",
        "primitive": "line",
        "points": [
          {"x": 0.24, "y": 0.64},
          {"x": 0.58, "y": 0.64}
        ]
      }
    },
    {
      "id": "continuous-shelf",
      "type": "continuous_shelf",
      "geometry": {
        "precision": "approximate",
        "primitive": "rect",
        "bounds": {"x": 0.62, "y": 0.48, "width": 0.15, "height": 0.18}
      }
    }
  ],
  "relationships": [
    {"from": "upper-rod", "to": "lower-rod", "type": "vertical_spacing"},
    {"from": "lower-rod", "to": "closet", "type": "floor_clearance_reference"},
    {"from": "overhead-shelf", "to": "closet", "type": "defines_upper_storage_zone"}
  ],
  "measurements": [
    "MEAS-CPNC-2025-P0203-001",
    "MEAS-CPNC-2025-P0203-002",
    "MEAS-CPNC-2025-P0203-003"
  ],
  "annotations": [
    {
      "id": "ann-overhead-shelf",
      "target_entity_id": "overhead-shelf",
      "text": "Entrepaño del maletero",
      "placement": {"x": 0.20, "y": 0.18, "precision": "approximate"}
    },
    {
      "id": "ann-continuous-shelf",
      "target_entity_id": "continuous-shelf",
      "text": "Entrepaño continuo para ropa doblada",
      "placement": {"x": 0.52, "y": 0.73, "precision": "approximate"}
    }
  ],
  "layers": [
    {
      "id": "closet-structure",
      "order": 10,
      "entity_ids": ["closet", "overhead-shelf", "continuous-shelf"]
    },
    {
      "id": "hanger-rods",
      "order": 20,
      "entity_ids": ["upper-rod", "lower-rod"]
    },
    {
      "id": "labels",
      "order": 30,
      "annotation_ids": ["ann-overhead-shelf", "ann-continuous-shelf"]
    }
  ],
  "camera": {
    "coordinate_space": "normalized_figure",
    "viewport": {"x": 0, "y": 0, "width": 1, "height": 1}
  },
  "reconstruction": {
    "preferred_renderer": "svg",
    "deterministic_required": true,
    "generative_image_allowed": false,
    "render_contract": "normalized-2d-v1"
  },
  "accessibility": {
    "summary": "Referencia simplificada de clóset con entrepaño de maletero, entrepaño continuo y dos tubos colgaderos, acompañada por las medidas canónicas de la página."
  },
  "review": {
    "status": "VISUALLY_VERIFIED",
    "notes": "La geometría normalizada es una aproximación pedagógica de la disposición observada en la fuente y no codifica dimensiones físicas. Se preservan sin reinterpretar las tres medidas canónicas: 90 cm a 1 m entre tubos colgaderos y 90 cm entre el tubo inferior y el piso."
  }
}
