{
  "figure_id":"FIG-CPNC-2025-P0029-001",
  "page_id":"PAGE-CPNC-2025-P0029",
  "type":"process_diagram",
  "purpose":"Representar la infografía Carpintero Digital y sus cinco pasos de trabajo de forma reutilizable para web, móvil o material educativo.",
  "source":{"book_id":"cpnc-2025","pdf_page":29,"printed_page":7,"region":{"x":0.01,"y":0.01,"width":0.98,"height":0.94},"extraction":{"method":"visual","confidence":0.99,"review_status":"VISUALLY_VERIFIED"}},
  "entities":[
    {"id":"title","type":"title","geometry":{"primitive":"text_block","precision":"approximate","bounding_box":{"x":0.08,"y":0.02,"width":0.84,"height":0.14}},"description":"Título CARPINTERO DIGITAL con el subtítulo Hágalo desde cualquier parte del mundo."},
    {"id":"carpenter","type":"carpenter_character","geometry":{"primitive":"illustration","precision":"approximate","bounding_box":{"x":0.30,"y":0.23,"width":0.42,"height":0.62}},"description":"Personaje central de carpintero con teléfono en una mano y caja de herramientas en la otra."},
    {"id":"step-1","type":"process_step","geometry":{"primitive":"badge","precision":"approximate","bounding_box":{"x":0.05,"y":0.20,"width":0.23,"height":0.13}},"description":"Paso 1: Medición, representado con una cinta métrica."},
    {"id":"step-2","type":"process_step","geometry":{"primitive":"badge","precision":"approximate","bounding_box":{"x":0.73,"y":0.22,"width":0.23,"height":0.13}},"description":"Paso 2: Diseño, representado con elementos de dibujo/diseño."},
    {"id":"step-3","type":"process_step","geometry":{"primitive":"badge","precision":"approximate","bounding_box":{"x":0.73,"y":0.40,"width":0.24,"height":0.15}},"description":"Paso 3: Selección de materiales, representado con piezas de madera o tablero."},
    {"id":"step-4","type":"process_step","geometry":{"primitive":"badge","precision":"approximate","bounding_box":{"x":0.05,"y":0.37,"width":0.25,"height":0.15}},"description":"Paso 4: Armado / instalación, representado con herramientas manuales."},
    {"id":"step-5","type":"process_step","geometry":{"primitive":"badge","precision":"approximate","bounding_box":{"x":0.04,"y":0.55,"width":0.23,"height":0.14}},"description":"Paso 5: Solución, representado con una herramienta eléctrica."},
    {"id":"digital-device","type":"laptop","geometry":{"primitive":"illustration","precision":"approximate","bounding_box":{"x":0.67,"y":0.61,"width":0.25,"height":0.18}},"description":"Portátil sobre una mesa que refuerza la idea de trabajo digital/remoto."}
  ],
  "relationships":[
    {"from":"step-1","to":"step-2","type":"precedes"},{"from":"step-2","to":"step-3","type":"precedes"},{"from":"step-3","to":"step-4","type":"precedes"},{"from":"step-4","to":"step-5","type":"precedes"},{"from":"carpenter","to":"digital-device","type":"associated_with_digital_work"}
  ],
  "measurements":[],
  "annotations":[
    {"target_entity_id":"title","text":"CARPINTERO DIGITAL — Hágalo desde cualquier parte del mundo"},{"target_entity_id":"step-1","text":"1. Medición"},{"target_entity_id":"step-2","text":"2. Diseño"},{"target_entity_id":"step-3","text":"3. Selección de materiales"},{"target_entity_id":"step-4","text":"4. Armado / instalación"},{"target_entity_id":"step-5","text":"5. Solución"}
  ],
  "camera":{"view":"front","projection":"orthographic"},
  "visual_style":{"format":"infografía editorial ilustrada","background":"escena cálida de taller/playa","palette":"amarillo, naranja, azul y verde","layout":"personaje central con cinco pasos distribuidos alrededor","text_hierarchy":"título grande arriba, etiquetas numeradas junto a iconos"},
  "educational_sequence":[
    {"step":1,"show_entity_ids":["title","carpenter"],"instruction":"Presentar el concepto de Carpintero Digital."},{"step":2,"show_entity_ids":["step-1"],"instruction":"Introducir Medición como primer paso."},{"step":3,"show_entity_ids":["step-2"],"instruction":"Introducir Diseño como segundo paso."},{"step":4,"show_entity_ids":["step-3"],"instruction":"Introducir Selección de materiales como tercer paso."},{"step":5,"show_entity_ids":["step-4"],"instruction":"Introducir Armado / instalación como cuarto paso."},{"step":6,"show_entity_ids":["step-5"],"instruction":"Introducir Solución como quinto paso."}
  ],
  "reconstruction":{"preferred_renderer":"svg","deterministic_required":false,"generative_image_allowed":true},
  "accessibility":{"summary":"Infografía con un carpintero central y cinco pasos alrededor: medición, diseño, selección de materiales, armado/instalación y solución. Un portátil y un teléfono refuerzan el concepto de trabajo digital."},
  "review":{"status":"VISUALLY_VERIFIED","notes":"Las posiciones y proporciones son aproximadas. Los cinco nombres y su orden deben conservarse exactamente; la ilustración decorativa puede reinterpretarse."}
}
