{
  "figure_id":"FIG-CPNC-2025-P0090-001","page_id":"PAGE-CPNC-2025-P0090","type":"process_diagram","purpose":"Recrear el proceso visual simplificado de conformación de un tablero alistonado a partir de piezas de madera sólida.",
  "source":{"book_id":"cpnc-2025","pdf_page":90,"printed_page":68,"region":{"x":0.05,"y":0.05,"width":0.90,"height":0.90},"extraction":{"method":"visual","confidence":0.99,"review_status":"VISUALLY_VERIFIED"}},
  "entities":[{"id":"species-samples","type":"wood_species_samples","geometry":{"primitive":"blocks","precision":"approximate"},"description":"Muestras rotuladas PINO, ROBLE, ACACIA y TECA."},{"id":"wood-strips","type":"solid_wood_strips","geometry":{"primitive":"bars","precision":"approximate"},"description":"Listones de madera antes de conformar el tablero."},{"id":"round-pieces","type":"wood_piece_examples","geometry":{"primitive":"ovals","precision":"approximate"},"description":"Ejemplos de piezas de teca según rótulo visual."},{"id":"board","type":"solid_wood_strip_board","geometry":{"primitive":"board","precision":"exact","dimensions":{"width_m":1.22,"length_m":2.44}},"description":"Tablero alistonado terminado."}],
  "relationships":[{"from":"species-samples","to":"wood-strips","type":"source_material"},{"from":"wood-strips","to":"board","type":"assembled_into"},{"from":"round-pieces","to":"board","type":"illustrates_source_material"}],"measurements":["MEAS-CPNC-2025-P0090-001","MEAS-CPNC-2025-P0090-002"],"annotations":[{"target_entity_id":"board","text":"1.22 m x 2.44 m"}],"camera":{"view":"front","projection":"orthographic"},"visual_style":{"format":"infografía educativa","palette":"madera y crema","linework":"contornos oscuros"},"educational_sequence":[{"step":1,"show_entity_ids":["species-samples"],"instruction":"Presentar especies de madera sólida."},{"step":2,"show_entity_ids":["wood-strips","round-pieces"],"instruction":"Mostrar ejemplos de piezas individuales."},{"step":3,"show_entity_ids":["board"],"instruction":"Mostrar el tablero alistonado resultante."}],"reconstruction":{"preferred_renderer":"svg","deterministic_required":true,"generative_image_allowed":false},"accessibility":{"summary":"Infografía de especies pino, roble, acacia y teca que se convierten en un tablero alistonado de 1.22 x 2.44 m."},"review":{"status":"VISUALLY_VERIFIED","notes":"Conservar la relación piezas de madera sólida → tablero; no añadir espesores que no aparecen en esta página."}
}
