{
  "figure_id": "FIG-CPNC-2025-P0259-001",
  "page_id": "PAGE-CPNC-2025-P0259",
  "type": "table",
  "purpose": "Recrear de forma determinista la lista de chequeo para puertas del Anexo 6, preservando sus tres bloques, encabezados, renglones y nota de uso.",
  "source": {
    "book_id": "cpnc-2025",
    "pdf_page": 259,
    "printed_page": 237,
    "region": {"x": 0.12, "y": 0.10, "width": 0.76, "height": 0.80},
    "extraction": {"method": "visual", "confidence": 0.99, "review_status": "VISUALLY_VERIFIED"}
  },
  "entities": [
    {
      "id": "title",
      "type": "title_block",
      "geometry": {"primitive": "text", "precision": "approximate", "bounding_box": {"x": 0.20, "y": 0.10, "width": 0.60, "height": 0.05}},
      "text": "ANEXO 6. LISTA DE CHEQUEO PARA PUERTAS"
    },
    {
      "id": "workshop-materials",
      "type": "checklist_section",
      "geometry": {"primitive": "table_rows", "precision": "approximate", "bounding_box": {"x": 0.13, "y": 0.16, "width": 0.74, "height": 0.22}},
      "headers": ["MATERIALES ARMADO EN TALLER", "*APLICA (REFERENCIA) NO APLICA (NA)", "CANTIDAD PRODUCCION"],
      "rows": [
        ["Bastidor 3x3 - 3x2.5", "", ""],
        ["Clavillos (Para usar con pistola)", "", ""],
        ["Enchape canto (19-22-33-44mm)", "", ""],
        ["Grapas", "", ""],
        ["Honey comb", "", ""],
        ["Lámina color (3-5.5-6-36MM)", "", ""],
        ["Pegante colbon y pegante para canto", "", ""],
        ["Pintura dilataciones", "", ""],
        ["Puntillas sin cabeza", "", ""],
        ["Masilla resane-lija", "", ""],
        ["Trapos limpieza-varsol-thiner", "", ""],
        ["Vinipel-cartón", "", ""]
      ]
    },
    {
      "id": "site-materials",
      "type": "checklist_section",
      "geometry": {"primitive": "table_rows", "precision": "approximate", "bounding_box": {"x": 0.13, "y": 0.38, "width": 0.74, "height": 0.26}},
      "headers": ["MATERIALES EN SITIO DE INSTALACIÓN", "*APLICA (REFERENCIA) NO APLICA (NA)", "CANTIDAD DESPACHO"],
      "rows": [
        ["Carteras-marcos-puertas", "", ""],
        ["Bisagras Omega", "", ""],
        ["Cerradura bola-palanca", "", ""],
        ["chazos-palillos madera", "", ""],
        ["Enchape (en caso de alguna reparación)", "", ""],
        ["Masilla resane-lija", "", ""],
        ["Pegante para canto y Colbón", "", ""],
        ["Pintura Resane", "", ""],
        ["Puntillas sin cabeza 1\" -3/4\"", "", ""],
        ["Riel para 1 puerta corredera (si aplica)", "", ""],
        ["Silicona", "", ""],
        ["Sistema riel 1 puerta corredera (si aplica)", "", ""],
        ["Tapatornillos", "", ""],
        ["Topepuerta", "", ""],
        ["Tornillos 5/8\" -1\"-1 1/2\"-2\"-3\"", "", ""],
        ["Trapos limpieza-varsol-thiner", "", ""]
      ]
    },
    {
      "id": "tools-equipment",
      "type": "checklist_section",
      "geometry": {"primitive": "table_rows", "precision": "approximate", "bounding_box": {"x": 0.13, "y": 0.64, "width": 0.74, "height": 0.27}},
      "headers": ["HERRAMIENTAS Y EQUIPO", "*APLICA (REFERENCIA) NO APLICA (NA)", "CANTIDAD"],
      "rows": [
        ["Bisturí", "", ""],
        ["Bolsas (perforación con taladro)", "", ""],
        ["Broca sierra y broca espada", "", ""],
        ["Caladora-Ruteadora-Rotomartillo-sierra circular-Ingleteadora", "", ""],
        ["Cepillo canteador", "", ""],
        ["Cinta de enmascarar y cinta aislante", "", ""],
        ["Compresor-Pistola con clavos", "", ""],
        ["Costal para recoger sobrantes", "", ""],
        ["Cuchilla para retestear el canto", "", ""],
        ["Elementos de protección", "", ""],
        ["Escoba y recogedor", "", ""],
        ["Espátula y estuco plástico", "", ""],
        ["Extensión de energía", "", ""],
        ["Flexómetro, nivel, escuadra", "", ""],
        ["Martillo,lápiz, formón, Destornilladores, Alicate, pelador cables", "", ""],
        ["Pistola de calafateo", "", ""],
        ["Segueta con marco", "", ""],
        ["Taladro para ensamblar e instalar (Puntas, brocas, avellanador)", "", ""]
      ]
    },
    {
      "id": "footnote",
      "type": "instruction_note",
      "geometry": {"primitive": "text", "precision": "approximate", "bounding_box": {"x": 0.13, "y": 0.91, "width": 0.74, "height": 0.03}},
      "text": "* En esta columna escribir la referencia que aplica. Sino aplica escribir NA."
    }
  ],
  "relationships": [
    {"from": "title", "to": "workshop-materials", "type": "introduces"},
    {"from": "workshop-materials", "to": "site-materials", "type": "followed_by"},
    {"from": "site-materials", "to": "tools-equipment", "type": "followed_by"},
    {"from": "tools-equipment", "to": "footnote", "type": "qualified_by"}
  ],
  "measurements": [],
  "annotations": [
    {"target_entity_id": "workshop-materials", "text": "CANTIDAD PRODUCCION"},
    {"target_entity_id": "site-materials", "text": "CANTIDAD DESPACHO"},
    {"target_entity_id": "tools-equipment", "text": "CANTIDAD"}
  ],
  "camera": {"view": "front", "projection": "orthographic"},
  "visual_style": {"format": "tabla de chequeo", "layout": "tres columnas con tres bloques verticales", "palette": "gris, amarillo pálido, blanco y negro", "linework": "rejilla rectangular fina", "caption_style": "encabezados en negrita y celdas de datos compactas"},
  "educational_sequence": [
    {"step": 1, "show_entity_ids": ["workshop-materials"], "instruction": "Verificar materiales de armado en taller y registrar referencia o NA y cantidad de producción."},
    {"step": 2, "show_entity_ids": ["site-materials"], "instruction": "Verificar materiales para instalación y registrar referencia o NA y cantidad de despacho."},
    {"step": 3, "show_entity_ids": ["tools-equipment", "footnote"], "instruction": "Verificar herramientas y equipo y aplicar la instrucción de referencia o NA."}
  ],
  "reconstruction": {"preferred_renderer": "html", "deterministic_required": true, "generative_image_allowed": false, "render_contract": "semantic-table-v1"},
  "accessibility": {"summary": "Lista de chequeo de puertas con materiales de taller, materiales en sitio de instalación y herramientas/equipo; cada bloque incluye aplicación o referencia y cantidad."},
  "review": {"status": "VISUALLY_VERIFIED", "notes": "Preservar los renglones tal como aparecen, incluidos usos de mayúsculas, guiones, unidades y la nota final. No completar cantidades ni referencias ausentes."}
}
